{
  "$schema": "https://json-schema.org/draft-07/schema#",
  "$id": "https://onebusaway.org/schemas/maglev-config.json",
  "title": "Maglev Configuration",
  "description": "Configuration schema for the Maglev OneBusAway server",
  "type": "object",
  "properties": {
    "port": {
      "type": "integer",
      "description": "API server port",
      "default": 4000,
      "minimum": 1,
      "maximum": 65535
    },
    "host": {
    "type": "string",
    "description": "The address to bind the server to. Defaults to all interfaces when empty.",
    "default": ""
    },
    "env": {
      "type": "string",
      "description": "Environment (development|test|production)",
      "enum": ["development", "test", "production"],
      "default": "development"
    },
    "api-keys": {
      "type": "array",
      "description": "API keys for authentication",
      "items": {
        "type": "string",
        "minLength": 1
      },
      "default": ["test"],
      "uniqueItems": true,
      "minItems": 1
    },
    "log-level": {
      "type": "string",
      "description": "Log Level (debug|info|warn|error)",
      "enum": ["debug", "info", "warn", "error"],
      "default": "info"
    },
    "log-format": {
      "type": "string",
      "description": "Format of logging output (text|json)",
      "enum": ["text", "json"],
      "default": "text"
    },
    "protected-api-keys": {
      "type": "array",
      "description": "Protected API keys for sensitive endpoints",
      "items": {
        "type": "string",
        "minLength": 1
      },
      "uniqueItems": true,
      "minItems": 1
    },
    "exempt-api-keys": {
      "type": "array",
      "description": "API keys that are exempt from rate limiting",
      "items": {
        "type": "string",
        "minLength": 1
      },
      "default": ["org.onebusaway.iphone"],
      "uniqueItems": true
    },
    "rate-limit": {
      "type": "integer",
      "description": "Requests per second per API key for rate limiting",
      "default": 100,
      "minimum": 1
    },
    "gtfs-static-feed": {
      "allOf": [{ "$ref": "#/definitions/staticFeed" }],
      "description": "Configuration for a single static GTFS feed. Cannot be combined with gtfs-static-feeds.",
      "default": {
        "url": "https://www.soundtransit.org/GTFS-rail/40_gtfs.zip"
      }
    },
    "gtfs-static-feeds": {
      "type": "array",
      "description": "Static GTFS feeds, in load order. Cannot be combined with gtfs-static-feed. Only the first feed is imported for now.",
      "items": { "$ref": "#/definitions/staticFeed" },
      "minItems": 1
    },
    "gtfs-rt-feeds": {
      "type": "array",
      "description": "Array of GTFS-RT feed configurations",
      "items": {
        "type": "object",
        "properties": {
          "id": {
            "type": "string",
            "description": "Unique identifier for this feed (auto-generated if missing)"
          },
          "agency-ids": {
            "type": "array",
            "description": "Optional subset of agency IDs that this feed provides data for",
            "items": {
              "type": "string"
            }
          },
          "trip-updates-url": {
            "type": "string",
            "description": "URL for a GTFS-RT trip updates feed",
            "format": "uri"
          },
          "vehicle-positions-url": {
            "type": "string",
            "description": "URL for a GTFS-RT vehicle positions feed",
            "format": "uri"
          },
          "service-alerts-url": {
            "type": "string",
            "description": "URL for a GTFS-RT service alerts feed",
            "format": "uri"
          },
          "realtime-auth-header-name": {
            "type": "string",
            "description": "Optional header name for GTFS-RT auth (legacy)"
          },
          "realtime-auth-header-value": {
            "type": "string",
            "description": "Optional header value for GTFS-RT auth (legacy)"
          },
          "headers": {
            "type": "object",
            "description": "Optional HTTP headers to send with requests to this feed",
            "additionalProperties": {
              "type": "string"
            }
          },
          "refresh-interval": {
            "type": "integer",
            "description": "Polling interval in seconds",
            "default": 30,
            "minimum": 1
          },
          "enabled": {
            "type": "boolean",
            "description": "Whether this feed is enabled",
            "default": true
          }
        },
        "additionalProperties": false
      },
      "default": [
        {
          "id": "sound-transit",
          "trip-updates-url": "https://api.pugetsound.onebusaway.org/api/gtfs_realtime/trip-updates-for-agency/40.pb?key=org.onebusaway.iphone",
          "vehicle-positions-url": "https://api.pugetsound.onebusaway.org/api/gtfs_realtime/vehicle-positions-for-agency/40.pb?key=org.onebusaway.iphone",
          "service-alerts-url": "",
          "refresh-interval": 30,
          "enabled": true
        }
      ]
    },
    "data-path": {
      "type": "string",
      "description": "Path to the SQLite database containing GTFS data (cannot contain '..' for security)",
      "default": "./gtfs.db"
    },
    "tls-cert-path": {
      "type": "string",
      "description": "Path to TLS certificate file. When set together with tls-key-path, the server serves HTTPS."
    },
    "tls-key-path": {
      "type": "string",
      "description": "Path to TLS private key file. When set together with tls-cert-path, the server serves HTTPS."
    }
  },
  "not": { "required": ["gtfs-static-feed", "gtfs-static-feeds"] },
  "definitions": {
    "staticFeed": {
      "type": "object",
      "properties": {
        "id": {
          "type": "string",
          "description": "Unique name for this feed in logs and metrics (default: feed-{n})"
        },
        "url": {
          "type": "string",
          "description": "URL for a static GTFS zip file (http/https URLs or local file paths)"
        },
        "default-agency-id": {
          "type": "string",
          "description": "Agency ID for entities in this feed that name no agency. Must be unique across feeds and must not contain '_'.",
          "pattern": "^[^_]*$"
        },
        "agency-id-mappings": {
          "type": "object",
          "description": "Renames agency IDs from agency.txt and routes.txt, old value to new value. New values must not contain '_'.",
          "additionalProperties": { "type": "string", "pattern": "^[^_]*$" }
        },
        "auth-header-name": {
          "type": "string",
          "description": "Optional header name for static GTFS feed authentication"
        },
        "auth-header-value": {
          "type": "string",
          "description": "Optional header value for static GTFS feed authentication"
        },
        "headers": {
          "type": "object",
          "description": "Optional HTTP headers to send with requests for this feed",
          "additionalProperties": { "type": "string" }
        },
        "enable-gtfs-tidy": {
          "type": "boolean",
          "description": "Enable GTFS tidying with gtfstidy tool (requires gtfstidy to be installed)",
          "default": false
        }
      },
      "required": ["url"],
      "additionalProperties": false
    }
  },
  "dependencies": {
    "tls-cert-path": ["tls-key-path"],
    "tls-key-path": ["tls-cert-path"]
  },
  "additionalProperties": false,
  "examples": [
    {
      "port": 8080,
      "host": "127.0.0.1",
      "env": "production",
      "api-keys": ["key1", "key2", "key3"],
      "protected-api-keys": ["secret1", "secret2"],
      "rate-limit": 50,
      "gtfs-static-feed": {
        "url": "https://example.com/gtfs.zip",
        "auth-header-name": "Authorization",
        "auth-header-value": "Bearer token456"
      },
      "gtfs-rt-feeds": [
        {
          "trip-updates-url": "https://api.example.com/trip-updates.pb",
          "vehicle-positions-url": "https://api.example.com/vehicle-positions.pb",
          "service-alerts-url": "https://api.example.com/service-alerts.pb",
          "realtime-auth-header-name": "Authorization",
          "realtime-auth-header-value": "Bearer token123"
        }
      ],
      "data-path": "/data/gtfs.db"
    },
    {
      "port": 3000,
      "env": "development"
    }
  ]
}
