{
  "$schema": "../config.schema.json",
  "port": 8080,
  "env": "production",
  "api-keys": ["key1", "key2", "key3"],
  "rate-limit": 50,
  "gtfs-static-feed": {
    "url": "https://example.com/gtfs.zip",
    "auth-header-name": "Authorization",
    "auth-header-value": "Bearer token456"
  },
  "log-level": "debug",
  "log-format": "json",
  "gtfs-rt-feeds": [
    {
      "trip-updates-url": "https://api.example.com/trip-updates.pb",
      "vehicle-positions-url": "https://api.example.com/vehicle-positions.pb",
      "service-alerts-url": "https://api.example.com/service-alerts.pb",
      "realtime-auth-header-name": "Authorization",
      "realtime-auth-header-value": "Bearer token123"
    }
  ],
  "data-path": "/data/gtfs.db"
}
